,title,case_id,top5
301,Department of Interior v. Klamath Water Users Protective Assn.,302,"stewart, tribes, documents, united, hitchings"
302,Department of Revenue of Ky. v. Davis,303,"kentucky, bonds, tax, reporting, brunstad"
303,Department of Transportation v. Association of American Railroads,304,"amtrak, gannon, standards, dupree, metrics"
304,Department of Transportation v. Public Citizen,305,"agency, kneedler, weissglass, trucks, environmental"
305,DePierre v. United States,306,"cocaine, base, pincus, crack, substance"
306,Derrick Kimbrough v. United States,307,"commission, guidelines, dreeben, nachmanoff, ratio"
307,Descamps v. United States,308,"johnson, horwich, california, burglary, element"
308,"Desert Palace, Inc. v. Costa",309,"ricciardi, plaintiff, 4th, floor, peccole"
309,Devenpeck v. Alford,310,"officer, phillips, hart, company1111, probable"
310,Devlin v. Scardelletti,311,"class, appeal, goldstein, intervention, settlement"
311,Dietz v. Bouldin,312,"jury, shanmugam, discharge, jurors, authority"
312,"Digital Realty Trust, Inc. v. Somers",313,"reporting, heritage, corporation, sec, report"
313,Dillon v. United States,314,"sentence, freeland, kruger, booker, commission"
314,Direct Marketing Assn. v. Brohl,315,"tax, domenico, collection, isaacson, injunction"
315,Director of Revenue of Mo. v. CoBank ACB,316,"hanson, bank, exemption, banks, tax"
316,"Directv, Inc. v. Imburgia",317,"arbitration, contract, landau, california, agreement"
317,District Attorney’s Office for Third Judicial Dist. v. Osborne,318,"neufeld, dna, test, alaska, innocence"
318,District of Columbia v. Heller,319,"amendment, dellinger, arms, gura, second"
319,"District of Columbia v. Tri County Industries, Inc.",320,"trial, jury, judge, standard, reischel"
320,District of Columbia v. Wesby,321,"kim, heritage, reporting, corporation, house"
321,Dixon v. United States,322,"defendant, jett, gornstein, defense, duress"
322,Dodd v. United States,323,"feldman, bergmann, reporting, company1111, decision"
323,Doe v. Chao,324,"stewart, campbell, effect, inc, adverse"
324,Doe v. Reed,325,"bopp, mckenna, public, petition, first"
325,Dolan v. Postal Service,326,"mail, millett, radmore, reporting, company1111"
326,Dolan v. United States,327,"karlan, restitution, sentence, appeal, judgment"
327,Dole Food Co. v. Patrickson,328,"foreign, paden, massey, ownership, interest"
328,Dollar General Corp. v. Mississippi Band of Choctaw Indians,329,"reporting, goldstein, jurisdiction, courts, katyal"
329,"Domino_s Pizza, Inc. v. McDonald",330,"contract, lichtenstein, mahoney, corporation, jwm"
330,Dorsey v. United States,331,"guidelines, sentencing, new, estrada, dreeben"
331,"Douglas v. Independent Living Center of Southern Cal., Inc.",332,"phillips, action, cause, supremacy, schwartz"
332,Dow Chemical Co. v. Stephenson,333,"waxman, class, smoger, 4th, floor"
333,Dretke v. Haley,334,"cruz, albritton, sentence, innocence, exception"
334,Duncan v. Owens,335,"levenstam, judge, trial, motive, illinois"
335,Duncan v. Walker,336,"bansal, loewenberg, inc, fourteenth, depo"
336,"Dura Pharmaceuticals, Inc. v. Broudo",337,"loss, stock, market, coughlin, company1111"
337,Dusenbery v. United States,338,"mail, notice, minear, procedures, person"
338,Eastern Associated Coal Corp. v. Mine Workers,339,"policy, public, arbitrator, contract, mooney"
339,"eBay Inc. v. MercExchange, L.L.C.",340,"patent, injunction, phillips, waxman, ebay"
340,EC Term of Years Trust v. United States,341,"tax, williams, maynard, refund, levy"
341,Edelman v. Lynchburg College,342,"charge, bell, employer, schnapper, commission"
342,"EEOC v. Abercrombie _ Fitch Stores, Inc.",343,"religious, employer, dvoretzky, policy, headscarf"
343,"EEOC v. Waffle House, Inc.",344,"eeoc, individual, gordon, action, clement"
344,Egelhoff v. Egelhoff,345,"erisa, plan, goldstein, kilberg, common"
345,Eldred v. Ashcroft,346,"copyright, lessig, olson, clause, first"
346,Elgin v. Department of Treasury,347,"mspb, schwartz, feigin, constitutional, authority"
347,Elk Grove Unified School Dist. v. Newdow,348,"god, newdow, pledge, religious, inc"
348,Elonis v. United States,349,"elwood, person, dreeben, threat, intent"
349,"Empire HealthChoice Assurance, Inc. v. McVeigh",350,"contract, stock, blue, benefits, cross"
350,"Encino Motorcars, LLC v. Navarro",351,"service, heritage, corporation, partsmen, clement"
351,Endrew F. v. Douglas County School Dist. RE-1,352,"katyal, standard, benefit, rowley, school"
352,Engine Mfrs. Assn. v. South Coast Air Quality Management Dist.,353,"vehicles, rules, inc, standards, california"
353,Engquist v. Oregon Dept. of Agriculture,354,"katyal, reporting, metcalf, employment, reason"
354,"Entergy Corp. v. Riverkeeper, Inc.",355,"available, lazarus, epa, costs, technology"
355,"Entergy La., Inc. v. Louisiana Pub. Serv. Comm_n",356,"ferc, tariff, 4th, floor, carpenter"
356,Environmental Defense v. Duke Energy Corp.,357,"modification, phillips, reporting, regulations, donahue"
357,"EPA v. EME Homer City Generation, L.P.",358,"epa, good, cost, neighbor, downwind"
358,Epic Systems Corp. v. Lewis,359,"arbitration, heritage, corporation, forum, section"
359,"Erica P. John Fund, Inc. v. Halliburton Co.",360,"class, market, certification, price, basic"
360,Esquivel-Quintana v. Sessions,361,"kedem, abuse, age, chevron, sexual"
361,Evans v. Chavis,362,"chatman, california, stris, company1111, days"
362,Evans v. Michigan,363,"judge, jury, defendant, element, trial"
363,Evenwel v. Abbott,364,"population, data, voters, consovoy, percent"
364,Ewing v. California,365,"denvir, sentence, nicola, california, crime"
365,Executive Benefits Ins. Agency v. Arkison,366,"consent, judgment, bankruptcy, judge, hallwarddriemeier"
366,Expressions Hair Design v. Schneiderman,367,"price, reporting, credit, card, surcharge"
367,Exxon Mobil Corp. v. Saudi Basic Industries Corp.,368,"coleman, page, castanias, reporting, preclusion"
368,"Exxon Mobile Corp. v. Allapattah Services, Inc.",369,"jurisdiction, diversity, page, action, zahn"
369,Exxon Shipping Co. v. Baker,370,"dellinger, fisher, punitive, damages, maritime"
370,"F. Hoffmann-LaRoche, Ltd. v. Empagran S.A.",371,"commerce, united, reporting, company1111, goldstein"
371,FAA v. Cooper,372,"damages, actual, privacy, distress, emotional"
372,FCC v. AT_T Inc.,373,"personal, privacy, yang, corporation, exemption"
373,"FCC v. Fox Television Stations, Inc.",374,"commission, verrilli, broadcast, phillips, nudity"
374,FCC v. NextWave Personal Communications Inc.,375,"fcc, bankruptcy, clement, payment, automatic"
375,Federal Election Comm_n v. Beaumont,376,"contributions, bopp, reporting, floor, contribution"
376,Federal Election Comm_n v. Colorado Republican Fed. Campaign Comm.,377,"party, candidate, underwood, money, inc"
377,"Federal Election Comm_n v. Wisconsin Right to Life, Inc.",378,"ads, clement, souter, mcconnell, election"
378,Federal Express Corp. v. Holowecki,379,"charge, notice, eeoc, reporting, form"
379,Federal Maritime Comm_n. v. South Carolina Ports Authority,380,"dean, immunity, commission, united, hughey"
380,Fellers v. United States,381,"waxman, amendment, dreeben, inc, sixth"
381,FERC v. Electric Power Supply Assn.,382,"ferc, wholesale, retail, market, demand"
382,Ferguson v. Charleston,383,"hood, police, hospital, criteria, medical"
383,Fernandez v. California,384,"police, randolph, fisher, consent, search"
384,Fernandez-Vargas v. Gonzales,385,"gossett, srinivasan, provision, iirira, reentry"
385,Festo Corp. v. Shoketsu Kinzoku Kogyo Kabushiki Co.,386,"patent, bork, bar, patentability, equivalents"
386,Fifth Third Bancorp v. Dudenhoeffer,387,"stock, information, reporting, plan, trustee"
387,Filarsky v. Delia,388,"immunity, mcgill, private, qualified, attorney"
388,First American Financial Corp. v. Edwards,389,"reporting, lamken, panner, injuryinfact, plaintiff"
389,Fisher v. University of Tex. at Austin,390,"race, university, percent, students, plan"
390,Fisher v. University of Texas at Austin,391,"rein, race, grutter, percent, university"
391,Fitzgerald v. Barnstable School Comm.,392,"title, hodge, section, discrimination, constitutional"
392,Fitzgerald v. Racing Assn. of Central Iowa,393,"iowa, 4th, floor, miller, tax"
393,Florence v. Board of Chosen Freeholders of County of Burlington,394,"phillips, search, reasonable, suspicion, policy"
394,Flores-Figueroa v. United States,395,"person, russell, heytens, identification, defendant"
395,Flores-Villar v. United States,396,"kneedler, hubachek, citizenship, child, mother"
396,"Florida Dept. of Revenue v. Piccadilly Cafeterias, Inc.",397,"plan, makar, tax, confirmation, brunstad"
397,Florida v. Department of Health and Human Servs.,398,"clement, money, program, take, secretary"
398,Florida v. Georgia,399,"water, corps, garre, florida, heritage"
399,Florida v. Harris,400,"dog, garre, gifford, dogs, records"
400,Florida v. Jardines,401,"dog, blumberg, door, officer, garre"
401,Florida v. Nixon,402,"lawyer, tillinghast, company1111, guilty, trial"
402,Florida v. Powell,403,"miranda, florida, jacquot, warnings, counsel"
403,Florida v. Thomas,404,"car, krauss, belton, search, arrest"
404,Fonseca Pereira v. Sessions,405,"notice, appear, liu, heritage, zimmer"
405,Ford Motor Co. v. McCauley,406,"berman, waxman, complaint, consolidated, jurisdiction"
406,Forest Grove School Dist. v. T.A.,407,"school, hearing, feinerman, education, child"
407,Foster v. Chatman,408,"burton, bright, batson, supreme, reasons"
408,Fowler v. United States,409,"officer, crawford, reporting, harrington, enforcement"
409,Fox v. Vice,410,"stancil, claims, fees, frivolous, rosenkranz"
410,Franchise Tax Bd. of Cal. v. Hyatt,411,"sovereign, immunity, nevada, california, clement"
411,Francisco Soso v. Alvarez-Machain,412,"hoffman, reporting, inc, action, phillips"
412,Franconia Associates v. United States,413,"breach, contract, page, petitioners, anticipatory"
413,Free Enterprise Fund v. Public Company Accounting Oversight Bd.,414,"board, carvin, president, kagan, control"
414,"Freeman v. Quicken Loans, Inc.",415,"reporting, hefferon, russell, service, hud"
415,Freeman v. United States,416,"guidelines, sentence, agreement, judge, heft"
416,Frew v. Hawkins,417,"decree, cruz, consent, young, parte"
417,Friedrichs v. California Teachers Assn.,418,"carvin, union, public, agency, employer"
418,Fry v. Napoleon Community Schools,419,"idea, relief, reporting, katyal, school"
419,Fry v. Pliler,420,"brecht, error, haltom, standard, moody"
420,"FTC v. Actavis, Inc.",421,"patent, weinberger, generic, stewart, brand"
421,"FTC v. Phoebe Putney Health System, Inc.",422,"hospital, waxman, authority, hospitals, power"
422,Gabelli v. SEC,423,"wall, liman, penalty, fraud, civil"
423,Garcetti v. Ceballos (Reargued),424,"robinvergeer, employee, lee, public, speech"
424,Garcetti v. Ceballos,425,"robinvergeer, lee, speech, public, company1111"
425,Gelboim v. Bank of America Corp.,426,"goldstein, judgment, waxman, action, appeal"
426,General Dynamics Corp. v. United States,427,"contract, phillips, katyal, party, default"
427,"General Dynamics Land Systems, Inc. v. Cline",428,"age, verrilli, older, inc, biggerman"
428,Genesis HealthCare Corp. v. Symczyk,429,"offer, judgment, mann, plaintiff, katyal"
429,Georgia v. Ashcroft,430,"walbert, black, districts, section, floor"
430,Georgia v. Randolph,431,"goldstein, police, company1111, souter, smith"
431,Giles v. California,432,"burkhardt, common, defendant, confrontation, come"
432,Gill v. Whitford,433,"heritage, corporation, smith, well, party"
433,Gisbrecht v. Barnhart,434,"fee, salmons, schnaufer, contingent, attorney"
434,Gitlitz v. Commissioner,435,"income, jones, tax, basis, hallett"
435,"Global Crossing Telecommunications, Inc. v. Metrophones Telecommunications, Inc.",436,"fcc, fisher, pay, unjust, unreasonable"
436,"Global-Tech Appliances, Inc. v. SEB S.A.",437,"patent, dunnegan, cruz, standard, knowledge"
437,Glossip v. Gross,438,"drug, konrad, wyrick, effect, pain"
438,Glover v. United States,439,"counsel, seventh, dreeben, prejudice, arguments"
439,Gobeille v. Liberty Mut. Ins. Co.,440,"plans, information, asay, data, health"
440,Golan v. Holder,441,"falzone, works, verrilli, protection, public"
441,Gomez-Perez v. Potter,442,"discrimination, retaliation, garre, reporting, age"
442,Gonzaga Univ. v. Doe,443,"policy, rights, school, secretary, funds"
443,Gonzales v. Carhart,444,"smith, procedure, clement, findings, doctors"
444,Gonzales v. O Centro Espirita Beneficiente Uniao Do Vegetal,445,"kneedler, hollander, treaty, company1111, souter"
445,Gonzales v. Oregon,446,"atkinson, clement, company1111, attorney, substances"
446,"Gonzales v. Planned Parenthood Federation of America, Inc.",447,"procedure, reporting, intact, clement, gartner"
447,Gonzales. v. Duenas-Alvarez,448,"meade, california, theft, himmelfarb, accessory"
448,Gonzalez v. Crosby,449,"rashkind, kise, limitations, first, aedpa"
449,Gonzalez v. Thaler,450,"millett, appeals, certificate, mitchell, judge"
450,Gonzalez v. United States,451,"judge, magistrate, article, newton, defendant"
451,Good News Club v. Milford Central School,452,"school, miller, marcelle, religious, inc"
452,"Goodyear Dunlop Tires Operations, S.A. v. Brown",453,"jurisdiction, peddie, carolina, north, petitioners"
453,Goodyear Tire _ Rubber Co. v. Haeger,454,"reporting, bergeron, causation, egbert, test"
454,"Grable _ Sons Metal Products, Inc. v. Darue Engineering _ Mfg.",455,"action, zagrans, merrell, dow, title"
455,Graham County Soil and Water Conservation Dist. v. United States ex rel. Wilson,456,"reporting, administrative, report, hurt, qui"
456,Graham County Soil _ Water Conservation Dist. v. United States ex rel. Wilson,457,"action, limitations, section, qui, tam"
457,Graham v. Florida,458,"life, parole, makar, age, sentence"
458,Granholm v. Heald,459,"company1111, souter, new, sullivan, casey"
459,Granite Rock Co. v. Teamsters,460,"contract, mathiason, bonsall, clause, july"
460,Gratz v. Bollinger,461,"payton, students, kolbo, race, university"
461,Great-West Life _ Annuity Ins. Co. v. Knudson,462,"plan, equitable, relief, injunction, jorden"
462,Green Tree Financial Corp. v. Bazzle,463,"arbitration, phillips, class, contract, 4th"
463,Green Tree Financial Corp.-Ala. v. Randolph,464,"arbitration, phillips, sellers, costs, judge"
464,Green v. Brennan,465,"discharge, wolfman, gannon, resignation, employer"
465,Greene v. Fisher,466,"fisher, teague, decision, eisenberg, supreme"
466,Greenlaw v. United States,467,"appeals, sentence, defendant, howe, jorgensen"
467,Groh v. Ramirez,468,"warrant, search, cordray, kozakiewicz, amendment"
468,"Gross v. FBL Financial Services, Inc.",469,"phillips, jury, schnapper, burden, waterhouse"
469,Grupo Dataflux v. Atlas Global Group,470,"boyce, greenberg, inc, caterpillar, trial"
470,Grutter v. Bollinger,471,"mahoney, race, kolbo, school, michigan"
471,Gundy v. United States,472,"heritage, attorney, corporation, wall, baumgartel"
472,Gunn v. Minton,473,"patent, michel, malpractice, jurisdiction, webre"
473,Halbert v. Michigan,474,"appeal, moran, michigan, counsel, appeals"
474,"Hall Street Associates, L.L.C. v. Mattel, Inc.",475,"phillips, section, brinkmann, parties, agreement"
475,Hall v. Florida,476,"test, waxman, score, standard, percent"
476,Hall v. Hall,477,"judgment, heritage, katyal, corporation, simpson"
477,Hall v. United States,478,"chapter, administrative, bankruptcy, estate, taxes"
478,"Halliburton Co. v. Erica P. John Fund, Inc.",479,"market, class, basic, price, streett"
479,"Halo Electronics, Inc. v. Pulse Electronics, Inc.",480,"phillips, patent, wall, damages, standard"
480,Hamdan v. Rumsfeld,481,"clement, war, katyal, military, souter"
481,Hamdi v. Rumsfeld,482,"dunham, company1111, military, clement, habeas"
482,Hamer v. Neighborhood Housing Serv. of Chicago,483,"herstoff, heritage, corporation, stewart, appeal"
483,Hamilton v. Lanning,484,"income, debtor, hamilton, plan, period"
484,Hammon v. Indiana,485,"friedman, officer, fisher, gornstein, witness"
485,"Hana Financial, Inc. v. Hana Bank",486,"jury, mark, marks, hughes, legal"
486,Harbison v. Bell,487,"chavis, proceedings, clemency, jay, counsel"
487,Hardt v. Reliance Standard Life Ins. Co.,488,"judgment, fees, rosenkranz, erisa, benefits"
488,Harrington v. Richter,489,"colombo, gardner, blood, merits, counsel"
489,Harris v. Arizona Independent Redistricting Comm_n,490,"districts, partisanship, hearne, percent, smith"
490,Harris v. Quinn,491,"union, smith, public, pay, bargaining"
491,Harris v. United States,492,"judge, apprendi, mandatory, jury, discretion"
492,Harris v. Viegelahn,493,"trustee, chapter, debtor, madden, goldblatt"
493,Hartman v. Moore,494,"mccartan, prosecution, kneedler, cause, probable"
494,Hawaii v. Office of Hawaiian Affairs,495,"hawaii, resolution, supreme, shanmugam, apology"
495,Hawkins v. Community Bank of Raymore,496,"applicant, credit, guarantor, mcallister, guarantors"
496,Haywood v. Drown,497,"underwood, new, reporting, york, courts"
497,Hedgpeth v. Pulido,498,"error, jury, harmless, friedlander, theory"
498,Heffernan v. City of Paterson,499,"goldstein, first, amendment, frost, political"
499,Heien v. North Carolina,500,"officer, reasonable, fourth, amendment, north"
500,Heimeshoff v. Hartford Life _ Accident Ins. Co.,501,"carroll, process, plan, limitations, wessler"
501,"Hein v. Freedom From Religion Foundation, Inc.",502,"money, pincus, clement, challenge, taxpayer"
502,"Hemi Group, LLC v. City of New York",503,"koerner, barnhouse, taxes, city, tax"
503,Henderson v. Shinseki,504,"appeal, blatt, miller, veterans, jurisdictional"
504,Henderson v. United States,505,"firearms, control, dealer, possession, felon"
505,Henson v. Santander Consumer USA Inc.,506,"debt, reporting, russell, debts, petitioners"
506,Hernandez v. Mesa,507,"border, hilliard, bivens, mexico, kneedler"
507,Herring v. United States,508,"karlan, dreeben, warrant, department, negligence"
508,Hertz Corp. v. Friend,509,"headquarters, business, place, corporation, srinivasan"
509,Hibbs v. Winn,510,"tax, assessment, goddard, cohen, inc"
510,"Highmark, Inc. v. Allcare Health Management System, Inc.",511,"legal, issues, construction, pierce, dunner"
511,"Hiibel v. Sixth Judicial Dist. Court of Nev., Humboldt Cty.",512,"dolan, officer, person, amendment, hafen"
512,Hill v. McDonough,513,"doss, florida, alternative, method, execution"
513,Hillman v. Maretta,514,"beneficiary, ruttenberg, divorce, insurance, johnson"
514,Hillside Dairy Inc. v. Lyons,515,"milk, clause, california, 4th, floor"
515,Hinck v. United States,516,"tax, interest, marcus, jurisdiction, redding"
516,"Hoffman Plastic Compounds, Inc. v. NLRB",517,"board, employer, wolfson, pay, mccortney"
517,Holder v. Humanitarian Law Project,518,"cole, kagan, terrorist, activities, lawful"
518,Holder v. Martinez Gutierrez,519,"child, reporting, status, kruger, residence"
519,Holland v. Florida,520,"lawyer, makar, holland, equitable, client"
520,Hollingsworth v. Perry,521,"california, cooper, marriage, olson, couples"
521,"Holmes Group, Inc. v. Vornado Air Circulation Systems, Inc.",522,"patent, dabney, gowdey, jurisdiction, counterclaim"
522,Holmes v. South Carolina,523,"blume, zelenka, third, guilt, party"
523,Holt v. Hobbs,524,"curran, deference, prison, laycock, yang"
524,Honeycutt v. United States,525,"property, money, forfeiture, liability, proceeds"
525,Hope v. Pelzer,526,"forrester, jones, work, schlick, gates"
526,Horne v. Department of Agriculture,527,"raisins, kneedler, mcconnell, program, property"
527,Horne v. Flores,528,"funding, plan, nogales, srinivasan, child"
528,Hosanna-Tabor Evangelical Lutheran Church and School v. EEOC,529,"laycock, religious, minister, church, kruger"
529,House v. Bell,530,"blood, smith, kissinger, reasonable, testimony"
530,"Household Credit Services, Inc. v. Pfennig",531,"credit, charge, limit, goldsmith, fee"
531,"Howard Delivery Service, Inc. v. Zurich American Ins.",532,"insurance, strain, verrilli, priority, benefit"
532,Howell v. Howell,533,"pay, property, retirement, disability, divorce"
533,Howell v. Mississippi,534,"offense, hood, mississippi, murder, beck"
534,Howes v. Fields,535,"jacobs, miranda, prison, custody, free"
535,"Howsam v. Dean Witter Reynolds, Inc.",536,"arbitration, parties, agreement, friedberg, arbitrability"
536,Hudson v. Michigan (Reargued),537,"moran, warrant, search, knock, baughman"
537,Hudson v. Michigan,538,"moran, entry, salmons, knockandannounce, police"
538,"Hughes v. Talen Energy Marketing, LLC",539,"ferc, auction, maryland, bid, price"
539,Hughes v. United States,540,"heritage, corporation, shumsky, marks, kovner"
540,Hui v. Castaneda,541,"bivens, doyle, action, claims, immunity"
541,Hunt v. Cromartie,542,"everett, democratic, race, look, precincts"
542,Hurst v. Florida,543,"jury, winsor, judge, death, waxman"
543,"Husky Int_l Electronics, Inc. v. Ritz",544,"fraud, fraudulent, actual, murphy, money"
544,Husted v. A. Philip Randolph Institute,545,"vote, heritage, corporation, notice, failure"
545,"IBP, Inc. v. Alvarez",546,"phillips, activities, principal, activity, company1111"
546,Idaho v. United States,547,"lands, reservation, lake, strack, inc"
547,"Illinois Tool Works Inc. v. Independent Ink, Inc.",548,"market, power, patent, presumption, product"
548,Illinois v. Caballes,549,"dog, meczyk, search, sniff, madigan"
549,Illinois v. Lidster,550,"police, ramsell, reporting, inc, feinerman"
550,Illinois v. McArthur,551,"police, cause, probable, jones, warrant"
551,"Impressions Products, Inc. v. Lexmark Int_l, Inc.",552,"patent, sale, patentee, exhaustion, rights"
552,Indiana v. Edwards,553,"trial, defendant, stancil, fisher, judge"
553,Indianapolis v. Edmond,554,"falk, dog, stop, chinn, car"
554,INS v. St. Cyr,555,"guttentag, inc, fourteenth, depo, kneedler"
555,"Integrity Staffing Solutions, Inc. v. Busk",556,"employer, thierman, work, principal, clement"
556,"Intel Corp. v. Advanced Micro Devices, Inc.",557,"commission, lynch, discovery, company1111, proceeding"
557,Inyo County v. Paiute-Shoshone Indians of Bishop Community of Bishop Colony,558,"chambers, kirby, 4th, floor, tribal"
558,Iowa v. Tovar,559,"counsel, plea, defendant, wilson, guilty"
559,Irizarry v. United States,560,"notice, judge, guidelines, madden, sentence"
560,"J. E. M. Ag Supply, Inc. v. Pioneer Hi-Bred International, Inc.",561,"patent, plant, protection, inc, johnson"
561,"J. McIntyre Machinery, Ltd. v. Nicastro",562,"united, new, manufacturer, jersey, distributor"
562,J.D.B. v. North Carolina,563,"blackman, miranda, officer, person, cooper"
563,Jackson v. Birmingham Bd. of Ed.,564,"title, retaliation, thomas, discrimination, dellinger"
564,Jackson v. Hobbs,565,"stevenson, life, holt, parole, arkansas"
565,"James LaRue v. DeWolff, Boberg _ Associates Inc., et al.",566,"plan, gies, fiduciary, breach, money"
566,James v. United States,567,"risk, burglary, marcus, potential, crawford"
567,"Janus Capital Group, Inc. v. First Derivative Traders",568,"frederick, jcm, statement, fund, funds"
568,"Janus v. State, County, and Municipal Employees",569,"heritage, reporting, corporation, public, union"
569,Jennings v. Rodriguez,570,"heritage, corporation, detention, stewart, months"
570,Jennings v. Stevens,571,"schaffer, appeal, counsel, judgment, oldham"
571,"Jerman v. Carlisle, McNellie, Rini, Kramer _ Ulrich LPA",572,"error, reporting, coakley, lawyer, debt"
572,"Jesinoski v. Countrywide Home Loans, Inc.",573,"rescission, notice, borrower, waxman, lender"
573,"Jesner v. Arab Bank, PLC.",574,"corporation, heritage, reporting, international, fisher"
574,Jimenez v. Quarterman,575,"appeal, texas, direct, jordan, postconviction"
575,Jinks v. Richland County,576,"lindemann, carolina, south, floor, courts"
576,John R. Sand _ Gravel Co. v. United States,577,"jurisdictional, irwin, reporting, haynes, limitations"
577,Johnson v. California,578,"grunder, prison, company1111, california, race"
578,Johnson v. United States,579,"possession, menendez, bash, use, crime"
579,Johnson v. Williams,580,"juror, brenan, hermansen, sixth, amendment"
580,Jones v. Bock,581,"olivieri, exhaustion, andre, prisoner, claims"
581,Jones v. Flowers,582,"kirkpatrick, address, property, phillips, mail"
582,Jones v. Harris Associates L.P.,583,"donovan, fiduciary, frederick, fee, services"
583,Jones v. R. R. Donnelley _ Sons Co.,584,"action, new, cause, section, inc"
584,"Jose Ernesto Medellin, v. Texas",585,"judgment, cruz, president, donovan, obligation"
585,JP Morgan Chase Bank v. Traffic Stream (BVI) Infrastructure Ltd.,586,"british, albert, kingdom, reid, subjects"
586,Judulang v. Holder,587,"crime, gannon, moral, turpitude, deportation"
587,Kaley v. United States,588,"srebnick, dreeben, grand, jury, probable"
588,Kansas v. Carr,589,"jury, reginald, jonathan, liu, kansas"
589,Kansas v. Cheever,590,"defendant, expert, amendment, defense, fifth"
590,Kansas v. Colorado,591,"fees, suthers, special, original, master"
591,Kansas v. Crane,592,"stovall, control, kansas, disorder, mental"
592,Kansas v. Gleason,593,"kansas, jury, schmidt, instruction, instructions"
593,Kansas v. Marsh (Reargued),594,"death, kline, woodman, jury, equipoise"
594,Kansas v. Marsh,595,"death, woodman, kline, jury, decision"
595,Kansas v. Nebraska,596,"master, mcallister, water, compact, parties"
596,Kansas v. Ventris,597,"amendment, counsel, defendant, trial, police"
597,Kappos v. Hyatt,598,"new, pto, anders, standard, applicant"
598,Kasten v. Saint-Gobain Performance Plastics Corp.,599,"complaint, phillips, kaster, oral, employer"
599,Kawasaki Kisen Kaisha Ltd. v. Regal-Beloit Corp.,600,"carrier, frederick, carmack, rail, ballenger"
600,Kawashima v. Holder,601,"tax, fraud, deceit, gannon, false"
601,"Kellogg Brown _ Root Services, Inc. v. United States, ex rel, Carter",602,"stone, offense, civil, elwood, criminal"
602,Kelly v. South Carolina,603,"dangerousness, jury, well, simmons, waters"
