,title,case_id,top5
603,Kelo v. New London,604,"bullock, horton, use, property, private"
604,Kennedy v. Louisiana,605,"rape, fisher, death, coker, child"
605,Kennedy v. Plan Administrator for DuPont Sav. and Investment Plan,606,"plan, levy, beneficiary, waiver, furlow"
606,"Kentucky Assn. of Health Plans, Inc. v. Miller",607,"insurance, eccles, provider, risk, drug"
607,Kentucky Retirement Systems v. EEOC,608,"years, age, retirement, service, person"
608,Kentucky v. King,609,"police, door, farley, drake, test"
609,Kerry v. Din,610,"kneedler, haddad, consular, husband, visa"
610,Khanh Phuong Nguyen v. United States,611,"article, iii, judge, millett, green"
611,"Kimble v. Marvel Enterprises, Inc.",612,"patent, brulotte, melnik, saunders, reason"
612,Kindred Nursing Centers Ltd. v. Clark,613,"arbitration, pincus, attorney, power, kentucky"
613,King v. Burwell,614,"carvin, exchange, verrilli, exchanges, qualified"
614,"Kingdomware Technologies, Inc. v. United States",615,"tripp, fss, reporting, saunders, contract"
615,Kingsley v. Hendrickson,616,"force, standard, punishment, use, test"
616,Kiobel v. Royal Dutch Petroleum Co.,617,"hoffman, sullivan, jurisdiction, verrilli, foreign"
617,Kircher v. Putnam Funds Trust,618,"perry, frederick, jurisdiction, slusa, remand"
618,"Kirtsaeng v. John Wiley _ Sons, Inc.",619,"copyright, reporting, rosenkranz, united, title"
619,Klein _ Co. Futures v. Board of Trade of City of New York,620,"transaction, contract, clearing, pincus, rules"
620,Kloeckner v. Solis,621,"harrington, discrimination, board, mspb, decision"
621,Knick v. Township of Scott,622,"sachs, heritage, corporation, compensation, condemnation"
622,Knight v. Commissioner,623,"trust, advice, miller, investment, rubin"
623,Knowles v. Mirzayance,624,"mercer, sevilla, hearing, strickland, defense"
624,Knox v. Service Employees,625,"young, notice, union, collins, assessment"
625,Kokesh v. SEC,626,"disgorgement, goldenberg, money, forfeiture, penalty"
626,Kontrick v. Ryan,627,"poor, inc, rules, jones, bankruptcy"
627,Koons v. United States,628,"sentence, guidelines, judge, heritage, minimum"
628,Koontz v. St. Johns River Water Management Dist.,629,"permit, nollan, dolan, wolfson, condition"
629,Kowalski v. Tesmer,630,"casey, moran, inc, michigan, counsel"
630,"KP Permanent Make-Up, Inc. v. Lasting Impression, Inc.",631,"confusion, brinkmann, mark, use, company1111"
631,"Krupski v. Costa Crociere, S. p. A.",632,"glazier, costa, cruise, mistake, reporting"
632,"KSR International Co. v. Teleflex, Inc.",633,"patent, goldstein, test, motivation, obvious"
633,Kucana v. Holder,634,"discretion, reopen, leiter, motions, attorney"
634,Kurns v. Railroad Friction Products Corp.,635,"use, design, locomotive, repair, frederick"
635,Kyllo v. United States,636,"lerner, heat, house, dreeben, inc"
636,"Laboratory Corp. of America Holdings v. Metabolite Laboratories, Inc.",637,"patent, stevens, step, test, morse"
637,Lackawanna County District Attorney v. Coss,638,"conviction, sentence, omalley, inc, fourteenth"
638,Lafler v. Cooper,639,"newman, plea, trial, judge, remedy"
639,Lagos v. United States,640,"investigation, heritage, corporation, huston, expenses"
640,"Lamar, Archer _ Cofrin, LLP v. Appling",641,"statement, financial, condition, heritage, corporation"
641,Lamie v. United States Trustee,642,"trustee, debtor, attorney, chapter, blatt"
642,Lane v. Franks,643,"employee, speech, job, public, garcetti"
643,Lapides v. Board of Regents of Univ. System of Ga.,644,"immunity, orland, claims, removal, bederman"
644,Law v. Siegel,645,"bankruptcy, debtor, property, trustee, hellman"
645,Lawrence v. Florida,646,"bonner, application, kise, petition, file"
646,Lawrence v. Texas,647,"rosenthal, smith, floor, texas, sexual"
647,Lawson v. FMR LLC,648,"contractor, fraud, perry, employees, schnapper"
648,League of United Latin American Citizens v. Perry,649,"map, section, smith, cruz, districts"
649,Ledbetter v. Goodyear Tire _ Rubber Co.,650,"pay, reporting, russell, discrimination, years"
650,Lee v. Kemna,651,"trial, witnesses, counsel, wilson, judge"
651,Lee v. Tam,652,"trademark, connell, stewart, program, mark"
652,Lee v. United States,653,"bursch, feigin, trial, defendant, kagan"
653,"Leegin Creative Leather Products, Inc. v. PSKS, Inc.",654,"price, resale, olson, maintenance, manufacturer"
654,Legal Services Corporation v. Velazquez,655,"neuborne, lawyer, legal, forum, services"
655,"Levin v. Commerce Energy, Inc.",656,"tax, fitch, mizer, taxes, comity"
656,Levin v. United States,657,"shah, tort, exception, immunity, feldman"
657,Lewis v. City of Chicago,658,"solomon, test, impact, disparate, practice"
658,Lewis v. Clarke,659,"immunity, tribe, sovereign, katyal, employee"
659,"Lewis v. Lewis _ Clark Marine, Inc.",660,"limitation, obrien, liability, inc, dripps"
660,"Lexmark Int_l, Inc. v. Static Control Components, Inc.",661,"lanham, interest, loy, test, jones"
661,Life Technologies Corp. v. Promega Corp.,662,"reporting, components, substantial, phillips, united"
662,Lightfoot v. Cendant Mortgage,663,"jurisdiction, fannie, competent, language, mae"
663,"Limelight Networks, Inc. v. Akamai Technologies, Inc.",664,"infringement, patent, steps, liability, waxman"
664,Limtiaco. v. Camacho,665,"jurisdiction, brinkmann, tax, waxman, value"
665,Lincoln Property Co. v. Roche,666,"joseph, party, lincoln, defendant, real"
666,Lingle v. Chevron U. S. A. Inc.,667,"test, compensation, stewart, property, basis"
667,Locke v. Davey,668,"religious, pierce, inc, clause, sekulow"
668,Locke v. Karass,669,"union, litigation, young, lehnert, collins"
669,Lockhart v. United States,670,"sexual, abuse, zas, minor, abusive"
670,Lockyer v. Andrade,671,"chemerinsky, danzig, california, solem, sentence"
671,Logan v. United States,672,"rights, reporting, civil, offender, serious"
672,"Long Island Care at Home, Ltd. v. Coke",673,"becker, exemption, department, regulation, regulations"
673,Lopez v. Davis,674,"bureau, prisons, program, meierhenry, discretion"
674,Lopez v. Gonzales,675,"kneedler, felony, reporting, crime, crooks"
675,Lorillard Tobacco Co. v. Reilly,676,"sutton, advertising, inc, fourteenth, depo"
676,"Los Angeles County Flood Control Dist. v. Natural Resources Council, Inc.",677,"permit, coates, colangelo, discharge, shah"
677,Los Angeles County v. Humphries,678,"pincus, policy, monell, coates, city"
678,"Los Angeles v. Alameda Books, Inc.",679,"adult, klekner, business, city, ordinance"
679,Los Angeles v. Patel,680,"goldstein, rosenkranz, records, hotel, police"
680,Loughrin v. United States,681,"bank, check, yang, reporting, russell"
681,Lozano v. Montoya Alvarez,682,"child, article, regan, return, convention"
682,Lozman v. Riviera Beach,683,"heritage, corporation, officer, karlan, arrest"
683,Lucia v. SEC,684,"heritage, corporation, metlitsky, officer, wall"
684,Luis v. United States,685,"money, assets, dreeben, srebnick, defendant"
685,"Lujan v. G _ G Fire Sprinklers, Inc.",686,"seideman, prime, money, fourteenth, inc"
686,Lynch v. Dimaya,687,"kneedler, reporting, burglary, criminal, rosenkranz"
687,Lynch v. Morales-Santana,688,"broome, kneedler, citizenship, united, remedy"
688,"Mach Mining, LLC v. EEOC",689,"goldstein, eeoc, conciliation, courts, agency"
689,"Mac_s Shell Service, Inc. v. Shell Oil Products Co.",690,"termination, constructive, contract, franchisee, franchise"
690,Madigan v. Levin,691,"theobald, scodro, adea, gera, seventh"
691,"Madigan v. Telemarketing Associates, Inc.",692,"copilevitz, charity, percent, huszagh, floor"
692,Madison v. Alabama,693,"heritage, stevenson, corporation, dementia, madison"
693,Magwood v. Patterson,694,"second, judgment, first, fisher, new"
694,Manrique v. United States,695,"appeal, notice, rashkind, judgment, restitution"
695,Manuel Ayestas v. Davis,696,"heritage, corporation, kovarsky, keller, necessary"
696,Manuel v. Joliet,697,"amendment, fourth, eisenhammer, scodro, prosecution"
697,Maples v. Thomas,698,"garre, counsel, neiman, maples, record"
698,Maracich v. Spears,699,"clement, guerra, litigation, solicitation, information"
699,Marinello v. United States,700,"heritage, reporting, parker, corporation, gorsuch"
700,Markazi v. Peterson,701,"lamken, particular, assets, kagan, like"
701,Marrama v. Citizens Bank of Mass.,702,"chapter, baker, debtor, bankruptcy, convert"
702,Marshall v. Marshall,703,"probate, jurisdiction, brunstad, bankruptcy, trust"
703,Martel v. Clair,704,"counsel, campbell, judge, waxman, clair"
704,Martin v. Franklin Capital Corp.,705,"heldman, reporting, company1111, chilton, removal"
705,Martinez v. Ryan,706,"counsel, bartels, cattani, trial, appeal"
706,Marvin M. Brandt Revocable Trust v. United States,707,"lechner, yang, easement, railroad, land"
707,Marx v. General Revenue Corp.,708,"costs, fees, provision, attorney, bad"
708,Maryland v. Blake,709,"ravenell, graeff, feldman, company1111, police"
709,Maryland v. King,710,"winfree, dreeben, person, search, fingerprints"
710,Maryland v. Pringle,711,"bair, forster, drugs, 4th, floor"
711,Maryland v. Shatzer,712,"davis, custody, edwards, gansler, counsel"
712,Maslenjak v. United States,713,"parker, landau, naturalization, kagan, statement"
713,Massachusetts v. EPA,714,"milkey, garre, air, agency, epa"
714,Massanari v. Sigmon Coal Co.,715,"woodrum, successor, coal, inc, fourteenth"
715,Massaro v. United States,716,"counsel, trial, direct, srinivasan, fahringer"
716,"Masterpiece Cakeshop, Ltd. v. Colorado Civil Rights Comm_n",717,"heritage, corporation, cake, speech, yarger"
717,Mata v. Lynch,718,"board, equitable, fifth, jurisdiction, reopen"
718,Match-E-Be-Nash-She-Wish Band of Pottawatomi Indians v. Patchak,719,"title, land, action, miller, nelson"
719,"Mathias v. Worldcom Technologies, Inc.",720,"bertocchi, contract, commission, interpretation, mcdowell"
720,Mathis v. United States,721,"descamps, burglary, approach, means, element"
721,Matrixx Initiatives v. Siracusano,722,"hacker, reporting, product, frederick, reports"
722,Mayle v. Felix,723,"habeas, porter, chan, different, civil"
723,"Mayo Collaborative Services v. Prometheus Laboratories, Inc.",724,"patent, different, process, bress, nature"
724,Mayo Foundation for Medical Ed. and Research v. United States,725,"olson, student, work, residents, exemption"
725,Mayorkas v. Cuellar de Osorio,726,"goldenberg, petition, conversion, automatic, date"
726,McBurney v. Young,727,"gupta, reporting, commerce, records, information"
727,McConnell v. Federal Election Comm_n,728,"money, parties, national, abrams, party"
728,McCoy v. Louisiana,729,"waxman, lawyer, heritage, client, corporation"
729,McCreary County v. American Civil Liberties Union of Ky.,730,"display, commandments, ten, company1111, religious"
730,McCrory v. Harris,731,"map, race, politics, clement, elias"
731,McCullen v. Coakley,732,"rienzi, zone, gershengorn, speech, massachusetts"
732,McCutcheon v. Federal Election Comm_n,733,"money, verrilli, candidates, murphy, limits"
733,McDonald v. City of Chicago,734,"amendment, feldman, rights, second, heller"
734,McDonnell v. United States,735,"dreeben, influence, action, decision, governor"
735,McFadden v. United States,736,"illegal, defendant, russell, harrington, drug"
736,McKune v. Lile,737,"program, wiltanger, prison, level, garre"
737,McLane Co. v. EEOC,738,"reporting, discretion, standard, kinnaird, test"
738,McNeill v. United States,739,"offense, gordon, conviction, defendant, felony"
739,McQuiggin v. Perkins,740,"bursch, readler, innocence, actual, diligence"
740,McWilliams v. Dunn,741,"expert, defense, ake, defendant, experts"
741,Meacham v. Knolls Atomic Power Laboratory,742,"age, burden, reasonable, waxman, russell"
742,MeadWestvaco Corp. v. Illinois Dept. of Revenue,743,"illinois, business, tax, barov, mead"
743,Medellin v. Dretke,744,"president, page, company1111, a34bda65a6f142d883ec09cfb6aa8dc6, treaty"
744,"MedImmune, Inc. v. Genentech, Inc.",745,"mahoney, patent, kester, license, agreement"
745,Medtronic Inc. v. Boston Scientific Corp.,746,"neustadt, burden, infringement, declaratory, patent"
746,Melendez-Diaz v. Massachusetts,747,"fisher, coakley, confrontation, test, defendant"
747,Mellouli v. Holder,748,"drug, laramore, kovner, substance, approach"
748,Menominee Tribe of Wis. v. United States,749,"class, strommer, tribe, action, claims"
749,"Merck KGaA v. Integra Lifesciences I, LTD.",750,"drug, flores, rosenkranz, merck, research"
750,Merck _ Co. v. Reynolds,751,"shanmugam, discovery, plaintiff, inquiry, information"
751,Meredith v. Jefferson County Bd. of Ed.,752,"school, schools, board, mellen, plan"
752,"Merit Management Group, LP v. FTI Consulting, Inc.",753,"transfer, walsh, heritage, corporation, trustee"
753,"Merrill Lynch, Pierce, Fenner _ Smith Inc. v. Manning",754,"hacker, new, complaint, jersey, duty"
754,"Merrill Lynch, Pierce, Fenner _ Smith, Inc. v. Dabit",755,"frederick, claims, connection, stevens, purchase"
755,Messerschmidt v. Millender,756,"wolfson, warrant, officer, coates, cause"
756,Metrish v. Lancaster,757,"michigan, mogill, supreme, bursch, capacity"
757,"Metro-Goldwyn-Mayer Studios Inc. v. Grokster, Ltd.",758,"verrilli, taranto, sony, infringing, clement"
758,Metropolitan Life Ins. Co. v. Glenn,759,"conflict, posner, decision, rosenkranz, reasonableness"
759,Meyer v. Holly,760,"benedon, broker, corporation, schwemm, meyer"
760,Michael A. Watson v. United States,761,"use, gun, koch, maynard, transaction"
761,Michael Rivera. v. Illinois,762,"error, jury, juror, illinois, violation"
762,Michigan v. Bay Mills Indian Community,763,"immunity, indian, bursch, tribe, lands"
763,Michigan v. Bryant,764,"van, hoek, reporting, police, emergency"
764,Michigan v. EPA,765,"costs, appropriate, verrilli, agency, health"
765,Mickens v. Taylor,766,"conflict, wagner, judge, reporting, inc"
766,Microsoft Corp. v. AT_T Corp.,767,"component, disk, code, olson, waxman"
767,Microsoft Corp. v. Baker,768,"reporting, appeal, class, stris, plaintiffs"
768,Microsoft Corp. v. i4i Ltd. Partnership,769,"patent, standard, clear, burden, presumption"
769,"Midland Funding, LLC v. Johnson",770,"bankruptcy, reporting, debt, geyser, defense"
770,"Milavetz, Gallop _ Milavetz, P.A. v. United States",771,"bankruptcy, brunstad, debt, attorney, jay"
771,Millbrook v. United States,772,"enforcement, officers, officer, scope, bucholtz"
772,Miller v. Alabama,773,"stevenson, life, parole, neiman, sentence"
773,Miller-El v. Cockrell,774,"jurors, trial, judge, waxman, juror"
774,Miller-El v. Dretke,775,"bunn, jurors, death, penalty, stevens"
775,Milner v. Department of Navy,776,"yang, exemption, personnel, agency, crooker"
776,"Mims v. Arrow Financial Services, LLC",777,"action, jurisdiction, nelson, garre, cause"
777,Ministry of Defense and Support for Armed Forces of Islamic Republic of Iran v. Elahi,778,"iran, tribunal, judgment, cubic, phillips"
778,Minneci v. Pollard,779,"bivens, preis, remedy, franklin, remedies"
779,Minnesota Voters Alliance v. Mansky,780,"breemer, political, heritage, corporation, rogan"
780,"Mississippi, Inc. ex rel. Hood v. AU Optronics Corp.",781,"action, massey, attorney, class, claims"
781,Missouri v. Frye,782,"plea, queener, trial, guilty, counsel"
782,Missouri v. McNeely,783,"warrant, reporting, shapiro, blood, test"
783,Missouri v. Siebert,784,"statement, miranda, mitchell, bartholow, inc"
784,Mohamad v. Palestinian Authority,785,"individual, person, word, united, ferguson"
785,"Mohawk Industries, Inc. v. Carpenter",786,"appeal, attorneyclient, resnik, important, judgment"
786,"Mohawk Industries, Inc. v. Williams",787,"enterprise, phillips, individuals, corporation, mohawk"
787,Molina-Martinez v. United States,788,"reporting, crooks, judge, guidelines, defendant"
788,Moncrieffe v. Holder,789,"goldstein, felony, conviction, look, provision"
789,Monsanto Co. v. Geertson Seed Farms,790,"robbins, injunction, reporting, agency, garre"
790,Montana v. Wyoming,791,"water, use, beneficial, bullock, montana"
791,Montanile v. Board of Trustees of Nat. Elevator Industry Health Benefit Plan,792,"equity, stris, equitable, plan, katyal"
792,Montejo v. Louisiana,793,"lawyer, counsel, defendant, jackson, police"
793,Montgomery v. Louisiana,794,"reporting, duncan, teague, miller, jurisdiction"
794,Moore v. Texas,795,"standards, texas, sloan, factors, current"
795,Morgan Stanley Capital Group Inc. v. Public Utility Distr. No. 1 of Snohomish Cty.,796,"market, ferc, reporting, contracts, contract"
796,Morrison v. National Australia Bank Ltd.,797,"dubbs, united, australia, test, foreign"
797,Morse v. Frederick,798,"school, reporting, starr, speech, tinker"
798,"Moseley v. V. Secret Catalogue, Inc.",799,"mark, dellinger, dilution, higgins, secret"
799,Mount Lemmon Fire Dist. v. John Guido,800,"heritage, corporation, agent, rosenkranz, employer"
800,Muehler v. Mena,801,"jury, company1111, search, phillips, hoffman"
801,Muhammad v. Close,802,"beckwith, casey, heck, sixth, prison"
802,Munaf v. Geren,803,"margulies, reporting, garre, united, habeas"
803,Murphy v. Smith,804,"percent, banner, heritage, fees, corporation"
804,Murr v. Wisconsin,805,"lot, groen, property, lots, look"
805,Musacchio v. United States,806,"jaffe, jury, martinez, indictment, limitations"
806,Mutual Pharmaceutical Co. v. Bartlett,807,"reporting, warning, drug, fda, frederick"
807,"M_G Polymers USA, LLC v. Tackett",808,"contract, benefits, agreement, clark, interpretation"
808,NASA v. Nelson,809,"katyal, stormer, information, questions, form"
809,National Assn. of Home Builders v. Defenders of Wildlife,810,"epa, species, glitzenstein, kneedler, agreement"
810,National Assn. of Mfrs. v. Department of Defense,811,"heritage, kovner, limitation, corporation, limitations"
811,National Cable _ Telecommunications Assn. v. Brand X Internet Services,812,"service, telecommunications, company1111, information, hungar"
812,"National Cable _ Telecommunications Assn., Inc. v. Gulf Power Co.",813,"cable, steindler, service, rate, inc"
813,National Federation of Independent Business v. Sebelius,814,"kneedler, provision, provisions, clement, coverage"
814,National Institute of Family and Life Advocates v. Becerra,815,"heritage, corporation, klein, farris, women"
815,National Meat Assn. v. Harris,816,"animals, scope, smith, slaughterhouse, nonambulatory"
816,National Park Hospitality Assn. v. Department of Interior,817,"geller, contracts, contract, elwood, 4th"
817,National Railroad Passenger Corporation v. Morgan,818,"englert, price, days, hostile, environment"
818,"Nautilus, Inc. v. Biosig Instruments, Inc.",819,"patent, harris, vandenberg, construction, reasonable"
819,Nebraska v. Parker,820,"reservation, tribe, smith, authority, clement"
820,Negusie v. Mukasey,821,"pincus, katsas, fedorenko, persecution, language"
821,Nelson v. Campbell,822,"newsom, stevenson, reporting, inc, execution"
822,Nelson v. Colorado,823,"money, banner, yarger, colorado, conviction"
823,Nevada Comm_n on Ethics v. Carrigan,824,"elwood, rosenkranz, amendment, relationship, commission"
824,Nevada Dept. of Human Resources v. Hibbs,825,"taggart, discrimination, women, family, equal"
825,Nevada v. Hicks,826,"tribal, howle, anaya, inc, fourteenth"
826,New Hampshire v. Maine,827,"decree, river, line, hampshire, boundary"
827,New Jersey v. Delaware,828,"new, jersey, riparian, frederick, farr"
828,New Prime Inc. v. Oliveira,829,"employment, heritage, contract, corporation, independent"
829,"New Process Steel, L. P. v. NLRB",830,"board, members, richie, group, katyal"
830,"New York State Board of Elections, ET AL. v. Margarita Lopez Torres, ET AL.",831,"party, schwarz, reporting, election, delegates"
831,New York Times Co. v. Tasini,832,"article, gold, inc, fourteenth, depo"
832,New York v. FERC,833,"transmission, ferc, retail, jurisdiction, sale"
833,Nichols v. United States,834,"gannon, jurisdiction, kansas, hansmeier, involved"
834,Nielsen v. Preap,835,"tripp, heritage, corporation, wang, custody"
835,Nijhawan v. Holder,836,"reporting, loss, gannon, offense, fraud"
836,"Nike, Inc. v. Kasky",837,"hoeber, california, tribe, speech, 4th"
837,Nixon v. Missouri Municipal League,838,"strauss, entity, reporting, inc, private"
838,Nken v. Mukasey,839,"stay, standard, removal, harrison, order"
839,NLRB v. Canning,840,"recess, senate, verrilli, president, session"
840,"NLRB v. Kentucky River Community Care, Inc.",841,"hawkins, board, judgment, fourteenth, depo"
841,"NLRB v. SW General, Inc.",842,"reporting, president, dvoretzky, person, interpretation"
842,Norfolk Shipbuilding _ Drydock Corp. v. Garris,843,"odonnell, ferrini, maritime, death, reporting"
843,Norfolk Southern R. Co. v. Sorrell,844,"cause, negligence, instruction, proximate, phillips"
844,Norfolk _ Western R. Co. v. Ayers,845,"cancer, lazarus, asbestosis, phillips, fear"
845,North Carolina State Bd. of Dental Examiners v. FTC,846,"board, mooppan, private, stewart, dentists"
846,Northern Ins. Co. of N. Y. v. Chatham County,847,"immunity, sovereign, county, hart, counties"
847,Northwest Austin Municipal Util. Dist. No. One v. Holder,848,"coleman, section, jurisdictions, discrimination, katyal"
848,"Northwest, Inc. v. Ginsberg",849,"contract, rosenbaum, covenant, parties, airline"
849,Norton v. Southern Utah Wilderness Alliance,850,"agency, action, kneedler, smith, inc"
850,"NRG Power Marketing, LLC v. Maine Pub. Util. Comm’n",851,"contract, standard, parties, blumenthal, rate"
851,OBB Personenverkehr AG v. Sachs,852,"united, fisher, basombrio, jurisdiction, commercial"
852,Obergefell v. Hodges,853,"marriage, hallwarddriemeier, whalen, recognize, marriages"
853,Ocasio v. United States,854,"conspiracy, davis, kedem, extortion, property"
854,"Octane Fitness, LLC v. Icon Health _ Fitness, Inc.",855,"phillips, patent, litigation, standard, injustice"
855,Office of Independent Counsel v. Favish,856,"privacy, favish, interest, inc, millett"
856,Office of Sen. Mark Dayton v. Hanson,857,"legislative, manning, office, speech, senator"
857,Ohio v. American Express Co.,858,"heritage, market, corporation, price, chesler"
858,Ohio v. Clark,859,"fisher, child, teacher, ohio, meyer"
859,"Oil States Energy Services, LLC v. Greene_s Energy Group, LLC",860,"patent, heritage, corporation, stewart, gorsuch"
860,Olympic Airways v. Husain,861,"accident, harakas, passenger, inc, convention"
861,"Omnicare, Inc. v. Laborers Dist. Council Constr. Industry Pension Fund",862,"statement, basis, opinion, reasonable, shanmugam"
862,"Oneok, Inc. v. Learjet, Inc.",863,"ferc, wholesale, retail, katyal, preemption"
863,Ontario v. Quon,864,"dammeier, privacy, messages, expectation, policy"
864,Oregon v. Guzek,865,"wolf, oregon, jury, williams, supreme"
865,Oregon v. Ice,866,"jury, lannet, reporting, judge, sentence"
866,Orff v. United States,867,"united, suit, contract, page, water"
867,Ortiz v. Jordan,868,"judgment, mills, trial, mizer, summary"
868,Osborn v. Haley,869,"scope, grant, reporting, employment, hallwarddriemeier"
869,Overton v. Bazzetta,870,"labelle, casey, floor, prison, children"
870,Owasso Independent School Dist. No. I-011 v. Falvo,871,"teacher, record, grade, wright, student"
871,Oxford Health Plans LLC v. Sutter,872,"arbitrator, class, arbitration, katz, reporting"
872,Pace v. DiGuglielmo,873,"wycoff, eisenberg, petition, pennsylvania, exceptions"
873,"Pacific Bell Telephone Co. v. linkLine Communications, Inc.",874,"price, duty, blecher, deal, squeeze"
874,"Pacific Operators Offshore, LLP v. Valladolid",875,"shelf, clement, longshore, workers, frederick"
875,"Pacificare Health Systems, Inc. v. Book",876,"whatley, arbitration, arbitrator, damages, floor"
876,Packingham v. North Carolina,877,"goldberg, montgomery, amendment, sites, facebook"
877,Padilla v. Kentucky,878,"defendant, lawyer, kinnaird, consequences, counsel"
878,Palazzolo v. Rhode Island,879,"burling, property, inc, fourteenth, depo"
879,Panetti v. Quarterman,880,"wiercioch, cruz, ford, panetti, petition"
880,Parents Involved in Community Schools v. Seattle School District,881,"school, schools, madden, korrell, race"
881,Paroline v. United States,882,"cassell, dreeben, restitution, amount, defendant"
882,Pasquantino v. United States,883,"dreeben, tax, foreign, revenue, brill"
883,Patchak v. Zinke,884,"heritage, corporation, gant, oconnell, jurisdiction"
884,Peake v. Sanders,885,"notice, miller, veterans, error, first"
885,Pearson v. Callahan,886,"police, officer, metzler, confidential, consent"
886,Pena-Rodriguez v. Colorado,887,"race, reporting, fisher, bias, jury"
887,Pennsylvania State Police v. Suders,888,"discharge, constructive, employer, bailey, employee"
888,Penry v. Johnson,889,"instruction, jury, penry, smith, inc"
889,Pepper v. United States,890,"judge, guidelines, sentence, parrish, mcleese"
890,Perdue v. Kenny A.,891,"cohen, rate, clement, judge, lodestar"
891,Perez v. Mortgage Bankers Assn.,892,"interpretation, interpretative, kneedler, agency, regulation"
892,Permanent Mission of India to United Nations v. City of New York,893,"property, lien, cardozo, howley, interest"
893,Perry v. Merit Systems Protection Bd.,894,"landau, fletcher, discrimination, board, civil"
894,Perry v. New Hampshire,895,"police, guerriero, process, due, witness"
895,Perry v. Perez,896,"plan, section, garza, clement, look"
896,"Petrella v. Metro-Goldwyn-Mayer, Inc.",897,"laches, limitations, copyright, years, equitable"
897,Peugh v. United States,898,"guidelines, reporting, sentence, feigin, range"
898,"PGA Tour, Inc. v. Martin",899,"farr, public, reardon, accommodation, rules"
899,Pharmaceutical Research and Mfrs. of America v. Concannon,900,"secretary, hagler, phillips, maine, program"
900,Philip Morris USA Inc. v. Williams,901,"instruction, shapiro, peck, oregon, supreme"
901,Philip Morris USA v. Williams,902,"harm, instruction, jury, frey, peck"
902,Pierce County v. Guillen,903,"hamilton, documents, mungia, clement, data"
903,Plains Commerce Bank v. Long Family Land _ Cattle Co.,904,"tribal, banker, jurisdiction, frederick, reservation"
