,title,case_id,top5
0,14 Penn Plaza LLC v. Pyett,1,"union, arbitration, bargaining, individual, collective"
1,Abbott v. Perez,2,"heritage, corporation, legislature, keller, districts"
2,Abbott v. United States,3,"clause, sentence, mcleese, minimum, provision"
3,Abdul-Kabir v. Quarterman,4,"jury, marshall, penry, johnson, brewer"
4,Abdur_Rahman v. Bell,5,"liebman, summers, successive, second, appeal"
5,Abramski v. United States,6,"gun, person, palmore, straw, dietz"
6,Abuelhawa v. United States,7,"miller, use, felony, phone, drug"
7,Adams v. Florida Power Corp.,8,"impact, age, disparate, crabtree, nager"
8,"Adarand Constructors, Inc. v. Mineta",9,"olson, pendley, program, standing, department"
9,Adoptive Couple v. Baby Girl,10,"father, rights, parent, blatt, custody"
10,Advocate Health Care Network v. Stapleton,11,"church, plan, feldman, plans, blatt"
11,Aetna Health Inc. v. Davila,12,"medical, plan, young, inc, care"
12,"Agency for Int_l Development v. Alliance for Open Society Int_l, Inc.",13,"page, program, bowker, srinivasan, policy"
13,Air Wisconsin Airlines Corp. v. Hoeper,14,"jury, tsa, russell, cohn, different"
14,Air _ Liquid Systems Corp. v. DeVries,15,"asbestos, heritage, goldstein, corporation, manufacturer"
15,"Alabama Dept. of Revenue v. CSX Transp., Inc..pdf(1).txt",16,"tax, railroads, well, brasher, carriers"
16,"Alabama Dept. of Revenue v. CSX Transp., Inc.",17,"tax, railroads, well, brasher, carriers"
17,Alabama Legislative Black Caucus v. Alabama,18,"districts, black, pildes, race, percent"
18,Alabama v. Bozeman,19,"stewart, christensen, inc, fourteenth, depo"
19,Alabama v. North Carolina,20,"carolina, phillips, commission, compact, money"
20,Alabama v. Shelton,21,"sentence, alabama, counsel, probation, pryor"
21,Alaska Dept. of Environmental Conservation v. EPA,22,"epa, franklin, hungar, authority, agency"
22,Alaska v. United States,23,"minear, lands, franklin, alaska, company1111"
23,Alexander v. Sandoval,24,"action, sutton, private, schnapper, regulations"
24,Ali v. Federal Bureau of Prisons,25,"officer, officers, customs, enforcement, shanmugam"
25,Alice Corp. v. CLS Bank Int’l,26,"computer, phillips, patent, patents, abstract"
26,Alleyne v. United States,27,"jury, judge, dreeben, maguire, mandatory"
27,Allison Engine Co. v. United States Ex Rel. Sanders,28,"reporting, olson, false, navy, contractor"
28,"Already, LLC v. Nike, Inc.",29,"covenant, goldstein, dabney, want, trademark"
29,"Altria Group, Inc. v. Good",30,"frederick, health, olson, cigarette, advertising"
30,Alvarez v. Smith,31,"castiglione, hearing, property, peters, class"
31,"American Broadcasting Co. v. Aereo, Inc.",32,"performance, public, clement, frederick, aereo"
32,American Elec. Power Co. v. Connecticut,33,"underwood, common, katyal, displacement, keisler"
33,American Express Co. v. Italian Colors Restaurant,34,"arbitration, kellogg, class, clement, costs"
34,American Ins. Assn. v. Garamendi,35,"foreign, california, kaplan, reporting, 4th"
35,"American Needle, Inc. v. National Football League",36,"nager, venture, reason, teams, nfl"
36,"American Trucking Assns., Inc. v. Browner",37,"health, public, warren, inc, fourteenth"
37,"American Trucking Assns., Inc. v. Los Angeles",38,"page, port, rosenthal, trucks, lerman"
38,"American Trucking Assns., Inc. v. Michigan Pub. Serv. Comm_n",39,"fee, michigan, interstate, boynton, intrastate"
39,"Americold Realty Trust v. ConAgra Foods, Inc.",40,"trust, look, trustees, entity, carden"
40,Amgen Inc. v. Connecticut Retirement Plans and Trust Funds,41,"class, market, waxman, materiality, reliance"
41,"Animal Science Products, Inc. v. Hebei Welcome Pharmaceutical Co.",42,"foreign, heritage, reporting, corporation, deference"
42,Anza v. Ideal Steel Supply Corp.,43,"roddy, new, frederick, fraud, rico"
43,Arbaugh v. Y _ H Corp.,44,"jurisdiction, matter, jurisdictional, prendergast, schwartz"
44,Archer v. Warner,45,"settlement, ayer, fraud, debt, bankruptcy"
45,Arizona Christian School Tuition Organization v. Winn,46,"money, bender, tax, program, religious"
46,Arizona Free Enterprise Club_s Freedom Club Pac v. Bennett,47,"maurer, candidate, public, reporting, candidates"
47,Arizona State Legislature v. Arizona Independent Redistricting Comm_n,48,"legislature, reporting, clement, power, well"
48,Arizona v. Gant,49,"belton, search, car, yang, arrest"
49,Arizona v. Inter Tribal Council of Ariz. Inc.,50,"page, horne, millett, require, commission"
50,Arizona v. Johnson,51,"officer, pincus, passenger, stop, seizure"
51,Arizona v. United States,52,"verrilli, clement, section, person, immigration"
52,Arkansas Dept. of Health and Human Servs. v. Ahlborn,53,"blair, settlement, medical, arkansas, millett"
53,Arkansas Game and Fish Comm_n v. United States,54,"kneedler, goodhart, land, flood, water"
54,Arlington Central School Dist. Bd. of Ed. v. Murphy,55,"fees, costs, vladeck, kuntz, attorneys"
55,Arlington v. FCC,56,"authority, agency, verrilli, chevron, fcc"
56,Armour v. Indianapolis,57,"stancil, clement, city, equal, barrett"
57,"Armstrong v. Exceptional Child Center, Inc.",58,"piotrowski, action, cms, withroe, rates"
58,Army Corps of Engineers v. Hawkes Co.,59,"jurisdictional, determination, hopper, stewart, corps"
59,Arthur Andersen LLP v. Carlisle,60,"section, arbitration, agreement, baker, enforce"
60,Arthur Andersen LLP v. United States,61,"company1111, mahoney, section, word, definition"
61,Artis v. District of Columbia,62,"period, alikhan, heritage, limitations, corporation"
62,Artuz v. Bennett,63,"castellano, application, procedural, claims, bar"
63,Ashcroft v. al-Kidd,64,"witness, immunity, material, absolute, prosecutor"
64,Ashcroft v. American Civil Liberties Union,65,"beeson, olson, inc, material, problem"
65,Ashcroft v. Free Speech Coalition,66,"sirkin, clement, child, defense, affirmative"
66,Ashcroft v. Iqbal,67,"garre, reinert, well, policy, petitioners"
67,Ashcroft v. Raich,68,"barnett, marijuana, commerce, clement, market"
68,"Association for Molecular Pathology v. Myriad Genetics, Inc.",69,"patent, castanias, dna, nature, new"
69,"Astra USA, Inc. v. Santa Clara County",70,"contract, secretary, blatt, frederick, agreement"
70,Astrue v. Capato,71,"child, children, rothfeld, miller, benefits"
71,Astrue v. Ratliff,72,"attorney, eaja, leach, fee, yang"
72,Atkins v. Virginia,73,"ellis, rumpz, reporting, death, mental"
73,Atkinson Trading Co. v. Shirley,74,"tax, cole, land, tribe, reservation"
74,Atlanatic Sounding Co. v. Townsend,75,"damages, punitive, maintenance, cure, jones"
75,Atlantic Marine Constr. Co. v. United States Dist. Court for Western Dist. Tex.,76,"forum, hastings, contract, allensworth, venue"
76,Atwater v. Largo Vista,77,"carli, arrest, george, officer, problem"
77,AT_T Corp. v. Hulteen,78,"seniority, russell, discrimination, discriminatory, system"
78,AT_T Mobility LLC v. Concepcion,79,"arbitration, contract, pincus, unconscionability, class"
79,Ayers v. Belmontes,80,"johnson, factor, multhaup, crime, jury"
80,Ayotte v. Planned Parenthood of Northern New Eng.,81,"company1111, exception, dalven, health, ayotte"
81,Bailey v. United States,82,"summers, wall, officers, search, police"
82,"Baker Botts, L.L.P. v. ASARCO LLC",83,"fee, bankruptcy, application, estate, reasonable"
83,Baldwin v. Reese,84,"balske, myers, inc, oregon, counsel"
84,Ballard v. Commissioner,85,"judge, report, tax, hungar, trial"
85,Bank of America Corp. v. Miami,86,"city, katyal, property, cause, interest"
86,"Bank of America, N.A. v. Caulkett",87,"dewsnup, bibas, value, secured, lien"
87,Banks v. Dretke,88,"kendall, farr, bunn, banks, inc"
88,Barber v. Thomas,89,"year, days, sentence, sady, credit"
89,Barnes v. Gorman,90,"damages, punitive, title, robbins, nelson"
90,Barnhart v. Peabody Coal Co.,91,"october, unassigned, sutton, assignments, fund"
91,Barnhart v. Thomas,92,"job, work, commissioner, alter, step"
92,Barnhart v. Walton,93,"work, months, impairment, pryor, disability"
93,Bartlett v. Strickland,94,"percent, districts, group, thurman, minority"
94,Bartnicki v. Vopper,95,"information, inc, fourteenth, depo, public"
95,Bates v. Dow Agrosciences LLC,96,"label, company1111, waxman, product, frederick"
96,Baze v. Rees,97,"verrilli, englert, risk, protocol, drug"
97,Beard v. Banks,98,"krakoff, rovelli, inmates, prison, souter"
98,Beard v. Kindler,99,"discretion, eisenberg, courts, third, defendant"
99,Beck v. PACE Int_l Union,100,"plan, decision, merger, sponsor, clark"
100,Becker v. Montgomery,101,"sutton, signature, notice, inc, fourteenth"
101,Beckles v. United States,102,"guidelines, reporting, bergmann, sentence, judge"
102,"BedRoc Limited, LLC v. United States",103,"gravel, sand, mineral, sansonetti, valuable"
103,Begay v. United States,104,"crimes, katze, risk, kruger, injury"
104,Bell Atlantic v. Twombly,105,"richards, conspiracy, agreement, complaint, alleged"
105,Bell v. Cone,106,"hutton, counsel, moore, phase, jury"
106,Bell v. Kelly,107,"new, bress, facts, souter, first"
107,Bell v. Thompson,108,"smith, mandate, appeals, shors, petition"
108,Beneficial Nat. Bank v. Anderson,109,"action, cause, clark, floor, waxman"
109,Benisek v. Lamone,110,"heritage, kimberly, sullivan, corporation, first"
110,Berghuis v. Smith,111,"percent, lawrence, jurors, grand, courts"
111,Berghuis v. Thompkins,112,"jacobs, restuccia, police, miranda, want"
112,Bethune-Hill v. Virginia State Bd. of Elections,113,"elias, districts, percent, look, gornstein"
113,Betterman v. Montana,114,"defendant, prejudice, delay, trial, process"
114,BE_K Constr. Co. v. NLRB,115,"board, baskin, wallace, retaliatory, labor"
115,BG Group plc v. Republic of Argentina,116,"arbitration, treaty, agreement, argentina, united"
116,Bilski v. Kappos,117,"jakes, patent, process, machine, stewart"
117,Birchfield v. North Dakota,118,"warrant, rothfeld, blood, breath, mccarthy"
118,Black v. United States,119,"dreeben, estrada, fraud, harm, economic"
119,Black _ Decker Disability Plan v. Nord,120,"physician, conflict, rohlfing, ninth, 4th"
120,Blakely v. Washington,121,"judge, sentencing, fisher, inc, discretion"
121,Bloate v. United States,122,"stancil, motion, motions, days, pretrial"
122,Blueford v. Arkansas,123,"jury, sloan, verdict, judge, mcdaniel"
123,BNSF R. Co. v. Tyrrell,124,"jurisdiction, montana, murray, personal, business"
124,Board of Ed. Dist. No. 92 of Pottawatomie Cty. v. Earls,125,"school, drug, problem, students, vernonia"
125,"Board of Education of the City School District of the City of New York v. Tom F., on Behalf of Gilbert F., a Minor Child",126,"school, public, child, education, koerner"
126,"Board of Trustees of Leland Stanford Junior Univ. v. Roche Molecular Systems, Inc.",127,"stanford, assignment, title, invention, contractor"
127,Board of Trustees of the Univ. of Ala. v. Garrett,128,"sutton, gottesman, rational, basis, constitutional"
128,Bobby v. Bies,129,"retardation, mental, ohio, blume, atkins"
129,Bolivarian Republic of Venezuela v. Helmerich _ Payne Int_l Drilling Co.,130,"property, jurisdiction, international, carroll, jurisdictional"
130,Bond v. United States,131,"power, clement, verrilli, convention, legislation"
131,Booth v. Churner,132,"prison, administrative, money, pappert, process"
132,Borden Ranch Partnership v. Army Corps of Engineers,133,"material, minear, bishop, conveyance, source"
133,Borough of Duryea v. Guarnieri,134,"petition, clause, schnapper, speech, employee"
134,Boulware v. United States,135,"maynard, corporation, return, capital, cline"
135,Boumediene v. Bush,136,"clement, habeas, waxman, souter, war"
136,Bowles v. Russell,137,"mancino, appeal, days, marshall, order"
137,Bowman v. Monsanto Co.,138,"seed, seeds, monsanto, walters, patent"
138,Boyer v. Louisiana,139,"counsel, sigler, trial, funding, louisiana"
139,Boyle v. United States,140,"enterprise, reporting, yang, fernich, pattern"
140,BP America Production Co. v. Burton,141,"administrative, lamken, joseffer, proceedings, action"
141,Bradshaw v. Stumpf,142,"wesley, freedman, stumpf, cole, trial"
142,Branch v. Smith,143,"plan, mcduff, constitutional, injunction, mississippi"
143,Bravo-Fernandez v. United States,144,"jury, conviction, blatt, yeager, error"
144,Brendlin v. California,145,"passenger, car, campbell, stop, zall"
145,Brentwood Academy v. Tennessee Secondary Athletic Assn.,146,"school, schools, public, colbert, board"
146,Breuer v. Jim_s Concrete of Brevard,147,"removal, 4th, floor, maintain, fair"
147,Brian Michael Gall v. United States,148,"judge, green, guidelines, dreeben, sentence"
148,Bridge v. Phoenix Bond _ Indemnity Co. Long Family Land _ Cattle Co.,149,"fraud, reporting, mail, civil, becker"
149,Brigham City v. Stuart,150,"studebaker, gray, officer, officers, knock"
150,Briscoe v. Virginia,151,"witness, friedman, defendant, confrontation, clause"
151,"Bristol-Myers Squibb Co. v. Superior Court of Cal., San Francisco Cty.",152,"california, goldstein, jurisdiction, katyal, interest"
152,Brown v. Payton,153,"jury, cortina, factor, prosecutor, payton"
153,Brown v. Sanders,154,"kirkland, jury, circumstances, factor, company1111"
154,"Browner v. American Trucking Assns., Inc.",155,"health, epa, standard, waxman, effects"
155,Bruce v. Samuels,156,"filing, fees, percent, prisoner, fee"
156,"Bruesewitz v. Wyeth, Inc.",157,"vaccine, frederick, sullivan, design, manufacturers"
157,Brumfield v. Cain,158,"desanctis, hearing, burns, record, standard"
158,Buck v. Davis,159,"swarns, buck, keller, fifth, jury"
159,"Buckeye Check Cashing, Inc. v. Cardegna",160,"contract, arbitration, company1111, prima, landau"
160,"Buckhannon Board _ Care Home, Inc. v. West Virginia Dept. of Health and Human Resources",161,"arceneaux, cleek, inc, fourteenth, depo"
161,Buckman Company v. Plaintiffs_ Legal Committee,162,"fda, use, geller, market, inc"
162,Buford v. United States,163,"strang, wolfson, consolidation, consolidated, appeals"
163,Bullard v. Blue Hills Bank,164,"plan, reporting, debtor, hallwarddriemeier, appeals"
164,Bullcoming v. New Mexico,165,"fisher, lab, report, defendant, trial"
165,"Bullock v. BankChampaign, N. A.",166,"trust, defalcation, loss, byrne, bensinger"
166,Burgess v. United States,167,"felony, fisher, offense, definition, drug"
167,Burlington N. _ S. F. R. Co. v. White,168,"phillips, standard, donati, employment, action"
168,Burlington N. _ S.F.R. Co. v. United States,169,"shell, stewart, waste, apportionment, product"
169,Burrage v. United States,170,"cause, heroin, death, butfor, substantial"
170,Burt v. Titlow,171,"plea, newman, record, titlow, toca"
171,Burton v. Stewart,172,"judgment, sentence, apprendi, fisher, petition"
172,Bush v. Gore,173,"boies, florida, olson, supreme, standard"
173,Bush v. Palm Beach County Canvassing Board,174,"florida, olson, section, supreme, constitution"
174,Byrd v. United States,175,"car, heritage, feigin, corporation, loeb"
175,"B_B Hardware, Inc. v. Hargis Industries, Inc.",176,"board, mark, use, infringement, different"
176,"C _ L Enterprises, Inc. v. Citizen Band Potawatomi Tribe of Okla.",177,"tribal, arbitration, minnis, jurisdiction, inc"
177,Calcano-Martinez v. United States,178,"guttentag, attorney, order, discretion, kneedler"
178,"California Public Employees_ Retirement System v. ANZ Securities, Inc.",179,"action, class, goldstein, clement, repose"
179,Campbell-Ewald Co. v. Gomez,180,"judgment, garre, plaintiff, offer, relief"
180,Camreta v. Greene,181,"kubitschek, child, seizure, kroger, decision"
181,Caperton v. A.T. Massey Coal Co.,182,"frey, olson, bias, judge, standard"
182,Carachuri-Rosendo v. Holder,183,"srinivasan, offense, felony, conviction, possession"
183,"Caraco Pharmaceutical Laboratories, Ltd. v. Novo Nordisk AS",184,"use, patent, fda, reporting, perry"
184,Carcieri v. Kempthorne,185,"indian, tribe, jurisdiction, maynard, olson"
185,Carey v. Musladin,186,"ott, buttons, fermino, trial, souter"
186,Carey v. Saffold,187,"california, cross, ogden, reporting, appeal"
187,"Carlsbad Technology, Inc. v. HIF Bio, Inc.",188,"jurisdiction, remand, thermtron, matter, rhodes"
188,Carpenter v. United States,189,"information, dreeben, heritage, corporation, wessler"
189,Carr v. United States,190,"sorna, register, rothfeld, sex, gannon"
190,Castle Rock v. Gonzales,191,"police, reichel, property, reporting, company1111"
191,Castro v. United States,192,"motion, second, frick, himmelfarb, successive"
192,CBOCS West v. Humphries,193,"hawkins, retaliation, action, sullivan, hyndman"
193,"Cedric Kushner Promotions, Ltd. v. King",194,"corporation, person, inc, fourteenth, depo"
194,Central Green Co. v. United States,195,"flood, water, frederick, control, canal"
195,Central Laborers_ Pension Fund v. Heinz,196,"plan, benefit, gossett, goldstein, company1111"
196,Central Va. Community College v. Katz,197,"thro, sovereign, lewis, immunity, bankruptcy"
197,Chadbourne _ Parke LLP v. Troice,198,"securities, fraud, purchase, clement, goldstein"
198,Chafin v. Chafin,199,"child, convention, residence, stay, habitual"
199,Chaidez v. United States,200,"new, strickland, padilla, teague, collateral"
200,Chamber of Commerce of United States v. Brown,201,"money, gottesman, reporting, policy, employer"
201,Chamber of Commerce of United States v. Whiting,202,"licensing, phillips, ogrady, laws, business"
202,Chambers v. United States,203,"risk, violent, hochman, crime, escape"
203,"Chao v. Mallard Bay Drilling, Inc.",204,"coast, guard, authority, veters, vessels"
204,"Chase Bank USA, N. A. v. McCoy",205,"rate, notice, board, beck, waxman"
205,Chavez v. Martinez,206,"amendment, fifth, paz, violation, well"
206,Chavez-Meza v. United States,207,"judge, heritage, corporation, rosenstein, coberly"
207,Cheney v. United States Dist. Court for D. C.,208,"discovery, olson, company1111, president, morrison"
208,Cherokee Nation of Okla. v. Thompson,209,"contract, miller, srinivasan, secretary, company1111"
209,"Chevron U. S. A., Inc. v. Echazabal",210,"shapiro, bagenstos, threat, risk, individual"
210,Chickasaw Nation v. United States,211,"luthey, dumont, tax, inc, fourteenth"
211,"China Agritech, Inc. v. Resh",212,"class, action, heritage, corporation, aronson"
212,"Christian Legal Soc. Chapter of Univ. of Cal., Hastings College of Law v. Martinez",213,"policy, garre, mcconnell, group, school"
213,Christie v. National Collegiate Athletic Assn.,214,"heritage, corporation, sports, new, clement"
214,Christopher v. Harbury,215,"cordray, information, harbury, access, courts"
215,Christopher v. SmithKline Beecham Corp.,216,"sales, clement, commitment, sale, goldstein"
216,CIGNA Corp. v. Amara,217,"plan, olson, summary, kneedler, harm"
217,Circuit City Stores v. Adams,218,"commerce, nagle, rubin, section, workers"
218,Citizens United v. Federal Election Commission (Reargued),219,"olson, corporations, kagan, interest, stevens"
219,Citizens United v. Federal Election Comm’n,220,"stewart, olson, advocacy, film, book"
220,City and County of San Francisco v. Sheehan,221,"feldman, officers, aken, ada, accommodation"
221,"City News _ Novelty, Inc. v. Waukesha",222,"olson, judicial, meitz, feldman, license"
222,City of Hays v. Vogt,223,"hearing, heritage, corporation, corkran, criminal"
223,"City of Littleton v. Z.J. Gifts D-4, L.L.C.",224,"gross, business, judicial, license, inc"
224,City of Sherrill v. Oneida Indian Nation of N. Y.,225,"new, land, treaty, york, company1111"
225,"Clackamas Gastroenterology Associates, P. C. v. Wells",226,"seymour, corporation, employees, common, crispin"
226,Claiborne v. United States,227,"judge, sentence, guidelines, reporting, appeals"
227,Clapper v. Amnesty International USA,228,"reporting, verrilli, jaffer, plaintiffs, authority"
228,Clark v. Arizona,229,"goldberg, defense, insanity, arizona, wrong"
229,Clark v. Martinez,230,"kneedler, company1111, united, aliens, detention"
230,Clark v. Rameker,231,"retirement, funds, debtor, account, shanmugam"
231,Class v. United States,232,"plea, heritage, guilty, corporation, feigin"
232,Clay v. United States,233,"judgment, bruin, different, finality, petition"
233,Cleveland v. United States,234,"dreeben, property, mogin, license, theory"
234,Clingman v. Beaver,235,"party, primary, reporting, company1111, parties"
235,"Coeur Alaska, Inc. v. Southeast Alaska Conservation Council",236,"fill, epa, waldo, effluent, material"
236,Coleman v. Court of Appeals of Md.,237,"women, leave, foreman, discrimination, howard"
237,Coleman v. Tollefson,238,"appeal, shanmugam, strike, dismissal, appeals"
238,Collins v. Virginia,239,"fitzgerald, heritage, corporation, cox, curtilage"
239,"Columbus v. Ours Garage _ Wrecker Service, Inc.",240,"cordray, sutton, safety, political, motor"
240,Comcast Corp. v. Behrend,241,"estrada, judge, class, daubert, damages"
241,"Commil USA, LLC v. Cisco Systems, Inc.",242,"patent, infringement, waxman, good, knowledge"
242,Commissioner v. Banks,243,"income, salmons, company1111, tax, attorney"
243,Comptroller of Treasury of Md. v. Wynne,244,"tax, income, maryland, perella, taxes"
244,CompuCredit Corp. v. Greenwood,245,"arbitration, sue, rights, action, mcconnell"
245,Cone v. Bell,246,"brady, goldstein, smith, drug, merits"
246,Conkright v. Frommert,247,"plan, administrator, second, stris, discretion"
247,Connecticut Dept. of Public Safety v. Doe,248,"information, sadin, public, dangerous, person"
248,Connick v. Thompson,249,"cooney, duncan, brady, prosecutors, canton"
249,"Cook County v. United States, ex rel. Chandler",250,"local, governments, damages, false, claims"
250,Cook v. Gralike,251,"mcadams, inc, fourteenth, depo, franklin"
251,"Cooper Industries, Inc. v. Leatherman Tool Group, Inc.",252,"reynolds, standard, discretion, massey, fourteenth"
252,Corley v. United States,253,"mcnabbmallory, dreeben, delay, mccolgin, confession"
253,Correctional Services Corp. v. Malesko,254,"corporation, pasternak, reporting, inc, fourteenth"
254,Costco Wholesale Corp. v. Omega S.A.,255,"section, copyright, united, englert, title"
255,County of Los Angeles v. Mendez,256,"feldman, police, officer, cause, entry"
256,Coventry Health Care of Mo. v. Nevils,257,"wessler, benefits, preemption, terms, laws"
257,Crawford v. Marion County Election Board,258,"smith, reporting, fisher, vote, souter"
258,Crawford v. Metropolitan Government of Nashville and Davidson Cty.,259,"young, investigation, opposition, schnapper, clause"
259,Crawford v. Washington,260,"fisher, inc, confrontation, statement, sherman"
260,Credit Suisse Securities (USA) LLC v. Billing,261,"sec, lovell, shapiro, laws, securities"
261,Credit Suisse Securities (USA) LLC v. Simmonds,262,"reporting, landau, years, limitations, equitable"
262,"CRST Van Expedited, Inc. v. EEOC",263,"fletcher, smith, prejudice, defendant, eeoc"
263,"CSX Transp., Inc. v. McBride",264,"cause, proximate, rothfeld, jury, frederick"
264,"CSX Transportation, Inc. v. Alabama Dept. of Revenue",265,"tax, maze, railroads, property, exemptions"
265,"CSX Transportation, Inc. v. Georgia State Bd. of Equalization",266,"value, calvert, methodology, market, phillips"
266,CTS Corp. v. Waldburger,267,"limitations, period, statutes, action, date"
267,Cullen v. Pinholster,268,"bilderback, new, facts, record, factual"
268,Cunningham v. California,269,"california, gold, laurence, judge, system"
269,"Cuomo v. Clearing House Assn., L.L.C.",270,"underwood, bank, enforcement, laws, enforce"
270,"Cuozzo Speed Technologies, LLC v. Lee",271,"patent, gannon, pto, board, beeney"
271,Currier v. Virginia,272,"heritage, corporation, second, trial, preclusion"
272,Cutter v. Wilkinson,273,"cole, prison, reporting, company1111, clause"
273,Cuyahoga Falls v. Buckeye Community Hope Foundation,274,"city, referendum, kramer, nager, petition"
274,"Cyan, Inc. v. Beaver County Employees Retirement Fund",275,"goldstein, heritage, corporation, katyal, covered"
275,Czyzewski v. Jevic Holding Corp.,276,"landau, reporting, priority, settlement, estate"
276,Dada v. Mukasey,277,"reopen, voluntary, departure, motion, meade"
277,Dahda v. United States,278,"order, heritage, corporation, tripp, shanmugam"
278,Daimler AG v. Bauman,279,"jurisdiction, california, russell, dupree, daimler"
279,DaimlerChrysler Corp. v. Cuno,280,"tax, enrich, ohio, olson, property"
280,Dalmazzi v. United States,281,"military, heritage, corporation, courts, office"
281,Danforth v. Minnesota,282,"butler, teague, diamond, remedy, constitutional"
282,Daniels v. United States,283,"conviction, dreeben, tanaka, sentence, custis"
283,"Dan_s City Used Cars, Inc. v. Pelkey",284,"page, vehicle, transportation, motor, tow"
284,Dart Cherokee Basin Operating Co. v. Owens,285,"reporting, sharp, berreth, tenth, decision"
285,Dastar Corp. v. Twentieth Century Fox Film Corp.,286,"cendali, dastar, 4th, floor, gerber"
286,Davenport v. Washington Ed. Assn.,287,"west, union, reporting, mckenna, money"
287,Davila v. Davis,288,"trial, counsel, martinez, appellate, assistance"
288,Davis v. Ayala,289,"urbanski, trial, dain, strategy, counsel"
289,Davis v. Federal Election Comm’n,290,"herman, clement, candidate, party, money"
290,Davis v. United States,291,"exclusionary, fourth, kerr, amendment, good"
291,Davis v. Washington,292,"fisher, reporting, confrontation, clause, call"
292,Day v. McDonough,293,"busby, limitations, discretion, kise, habeas"
293,Dean v. United States,294,"sentence, stoler, yang, guidelines, judge"
294,Deck v. Missouri,295,"nield, percival, page, jury, defendant"
295,Decker v. Northwest Environmental Defense Center,296,"epa, roads, bishop, fisher, industrial"
296,Delia v. E.M.A.,297,"medical, maddrey, percent, north, expenses"
297,Demore v. Hyung Joon Kim,298,"olson, rabinovitz, deportable, individual, individuals"
298,Department of Health and Human Servs. v. Florida,299,"market, insurance, health, verrilli, care"
299,Department of Homeland Security v. MacLean,300,"katyal, information, regulations, foia, ssi"
300,Department of Housing and Urban Development v. Rucker,301,"housing, renne, authority, tenant, lease"
